Class,Output,AnswerChoices,CorrectAnswer,AnswerTests,Hint,Figure,FigureType,VideoLink,Tag,,
figure,"Here I have created a box plot to represent the price data for each of the three car types: large, midsize, and small. You'll notice that each of the 3 figures is composed of a closed 4-sided \box\"" with \""whiskers\"" on the top and bottom",NA,NA,NA,NA,mod1_boxplot.R,new,NA,,NA
text,"The height of each box is referred to as the INTERQUARTILE RANGE (IQR). The more variability within the data, the larger the IQR. On the other hand, less variability within the data means a smaller IQR. The bottom of the box in the box plot corresponds to the value of the first quartile (Q1), and the top of the box corresponds to the value of the third quartile (Q3). To calculate the value of the IQR, simply subtract the value of Q1 from that of Q3.",NA,NA,NA,NA,NA,NA,NA,box-and-whisker plot,,
text,"The whiskers, or lines, that extend above and below each box represent roughly the upper 25% and lower 25% of data points, respectively. The only exception is when there are outliers, which I'll explain shortly.",NA,NA,NA,NA,NA,NA,NA,box-and-whisker plot,,
range_question,"Looking at the box plot, what is the approximate interquartile range for the midsize vehicles?",NA,16- 20,range=16- 20,Subtract the Q1 value from the Q3 value. The Q1 value is the minimum value contained in the box and the Q3 value is the maximum value contained in the box.,NA,NA,NA,box-and-whisker plot,,
text,"Let's take a closer look at how quartiles are calculated. We start by sorting the data from least to greatest, just like when calculating the median. The first quartile (Q1), also known at the 25th PERCENTILE (since 25% of the data points fall at or below this value), is simply the median of the first half of the sorted data. Likewise, the third quartile (Q3), also known as the 75th percentile, is the median of the second half of the sorted data.",NA,NA,NA,NA,NA,NA,NA,box-and-whisker plot,,
figure,"As shown in this plot, the blue horizontal line illustrates how to find the value for the first quartile. The green horizontal line illustrates how to find the value for the third quartile. The interquartile range is the range of data values that is contained in between these two lines.",NA,NA,NA,NA,mod1_boxplot_add.R,addition,NA,box-and-whisker plot,,
figure,"Look again at our box plot of price vs. car type. You may be thinking to yourself, 'What is that circle above the box plots for the midsize cars, and why is there no circle above the box plot for the large cars?' Those circles represent OUTLIERS in the data set. An OUTLIER is an observation that is unusual or extreme relative to the other values in the data set. Outliers are useful in identifying a heavy skew in a distribution, and may signify a data collection or data entry error to a scientist. There are many different conventions for identifying outliers within a data set.",NA,NA,NA,NA,mod1_boxplot.R,new,NA,box-and-whisker plot,,
text_many_question,"When looking at the box plot, which car types appear to have outliers? Separate your answers with a comma.",NA,"small, midsize","word_many=small, midsize",Look for the types of cars that correspond to the box plots with circles above or below them.,NA,NA,NA,box-and-whisker plot,,
text,"Since we have finished our introduction to the interquartile range, we will now take a look at the two other values used when describing the spread of the data: variance and standard deviation. Mathematically, VARIANCE is the average of the squared differences from the mean. Don't worry if you find this a little confusing. Intuitively, variance just represents the total distance of the data from the mean of the data.",NA,NA,NA,NA,NA,NA,NA,standard deviation and variance,,
text,"A low variance indicates that the data points tend to be located near the mean value, while a high variance indicates that the data points are spread further from the mean.",NA,NA,NA,NA,NA,NA,NA,standard deviation and variance,,
text,"A more conventional measure of variability is the STANDARD DEVIATION, which is calculated as the square root of the variance. Statisticians typically refer to standard deviation because it is expressed in the same units as the original data values. If you are interested in the details of how variance and standard deviation are calculated, I recommend taking a look at the following video.",NA,NA,NA,NA,NA,NA,NA,standard deviation and variance,,
video,Would you like to watch a brief YouTube video on variance and standard deviation?,NA,NA,NA,NA,NA,NA,http://youtu.be/E4HAYd0QnRc,standard deviation and variance,,
cmd_question,"Using the R command 'sd()', calculate the standard deviation of the data subset entitled 'mpg.midsize'.",NA,sd(mpg.midsize),swirl1cmd=sd(mpg.midsize),"If you wanted the sd of 'x', you would type 'sd(x)'.",NA,NA,NA,standard deviation and variance,,
exact_question,"Now that you have calculated the standard deviation of this data, can you tell me what is the variance of the data? To square a quantity in R, the notation is 'quantity^2', where the '^' symbol means 'to the power of'.",NA,3.593072,exact=3.593072,Variance is the standard deviation squared.,NA,NA,NA,standard deviation and variance,,
text,"To demonstrate differences in variability, I will again refer to the box plot of car type vs. price.",NA,NA,NA,NA,NA,NA,NA,box-and-whisker plot,,
figure,"As you can see in the box plot, the data for prices of 'midsize' cars vary from around 15 to 62, encompassing a range of approximately 50. This is a great deal larger than the variation for 'small' cars which range from around 5 to 15, encompassing a range of approximately 10. Therefore, since the range is much greater for 'midsize' cars, prices of 'midsize' cars have much higher variability in comparison to the prices of 'small' cars.",NA,NA,NA,NA,mod1_boxplot.R,new,NA,box-and-whisker plot,,
text_question,Now it is your turn! Is the variability of prices of cars of type 'large' higher or lower than that of cars of type 'small'?,NA,higher,word=higher,Look to see if the range of cars of type 'large' is greater or less than that of cars of type 'small'.,NA,NA,NA,box-and-whisker plot,,
text,"While dispersion measures the variability from the mean in a data set, another important property is the shape of the distribution of the data. We will learn much more about distributions in one of my subsequent lessons, but for now just think of DISTRIBUTION as a histogram.",NA,NA,NA,NA,NA,NA,NA,classifying shape of distributions,,
text,"Histograms are particularly useful in viewing and describing the shape of the distribution of the data. A distribution of data may have a left skew, a right skew, or no skew at all. SKEWNESS is a measure of the extent to which the distribution of the data 'leans' to one side or the other.",NA,NA,NA,NA,NA,NA,NA,classifying shape of distributions,,
figure,"A distribution that has a left skew is one in which the left TAIL of the plot is longer. In other words, on a histogram the majority of the distribution is located to the right of the mean. This distribution is also said to be left-skewed. When a distribution is left-skewed, the value of the MEAN is less than that of the MEDIAN, and thus the MEAN is located further to the left of the distribution. In this plot, the green line represents the median and the blue line represents the mean.",NA,NA,NA,NA,mod1_leftskew.R,new,NA,classifying shape of distributions,,
figure,"On the other hand, a distribution that has a right skew is one in which the right tail is longer, such that the majority of the data falls to the left of the mean, when viewed on the histogram. This distribution is said to be right-skewed. When a distribution is right-skewed, the value of the MEAN is greater than that of the MEDIAN, and thus the MEAN is located further to the right of the distribution. In this plot, the green line represents the median and the blue line represents the mean.",NA,NA,NA,NA,mod1_rightskew.R,new,NA,classifying shape of distributions,,
figure,"A plot that has no skew is one in which the tails on both sides of the mean balance out, and is referred to as symmetric. When a distribution is symmetric, the MEAN and MEDIAN are approximately equal in value. In this plot, the green line represents the median and the blue line represents the mean. The green line is the only one visible since the mean and median are so close to the same value.",NA,NA,NA,NA,mod1_symmetric.R,new,NA,classifying shape of distributions,,
figure,"Let's take a look back at the histogram we made earlier, which represents the distribution of the values for city MPG for each of the 54 cars from our 'cars' data set.",NA,NA,NA,NA,mod1_histogram.R,new,NA,classifying shape of distributions,,
mult_question,How would you classify the shape of the distribution represented by this histogram?,Symmetric; Right-skewed; Left-skewed,Right-skewed,word= Right-skewed,Look to see which tail extends further. The plot is said to be skewed in that direction.,NA,NA,NA,classifying shape of distributions,,
mult_question,"Referring to the same histogram, and keeping in mind your answer to the previous question, would you expect the MEDIAN to be greater than, less than, or equal to the MEAN?",Greater than; Less than; Equal to,Less than,word= Less than,Keep in mind that data points that create a plot's long tail will tend to 'pull' the mean in that direction. The median is not affected by how far away the data points are.,NA,NA,NA,classifying shape of distributions,,
text,"Up to this point, I have covered useful techniques to visualize numerical, or continuous variables, but what about categorical variables? Well, one useful way to display a single categorical variable is via a BAR GRAPH, in which the various categories lie on the x-axis and the numerical values corresponding to each category lie on the y-axis.",NA,NA,NA,NA,NA,NA,NA,bar graph,,
figure,"Here is a BAR GRAPH representing the average price for each of the three car types: large, midsize, and small. Because there are numerous data points within each category, the height of each bar is the MEAN price ($1000s) of all of the cars within that category.",NA,NA,NA,NA,mod1_bargraph.R,new,NA,bar graph,,
text_order_question,"According to the bar graph, which car type is the most expensive, on average? Which is the least expensive, on average? Answer the two questions in the same order with a comma separating the two answers.",NA,"midsize, small","word_order=midsize, small",Look at the corresponding car type for the tallest bar to determine which car is the most expensive. Look at the corresponding car type for the shortest bar to determine which car is the least expensive.,NA,NA,NA,bar graph,,
figure,The 'midsize' bar has been highlighted green and is the most expensive on average. The 'small' bar has been highlighted blue and is the least expensive on average.,NA,NA,NA,NA,mod1_bargraph_add.R,addition,NA,bar graph,,
range_question,"According to the bar graph, what is the average price for a 'large' car (in $1000s)?",NA,22- 26,range=22- 26,"Look at the highest value on the y-axis that the \large\"" bar reaches.""",NA,NA,NA,bar graph,,
figure,The red horizontal line added to the plot illustrates how to find your previous answer.,NA,NA,NA,NA,mod1_bargraph_add1.R,addition,NA,bar graph,,
text,"Up until now, every plot I have introduced has involved only one variable. But what if you are trying to analyze two variables? A SCATTER PLOT provides a comparative view of data for two numerical variables, with one on the x-axis and the other on the y-axis. This type of a plot is useful because it allows you to see whether two variables are related and to what degree.",NA,NA,NA,NA,NA,NA,NA,"continous, discrete, categorical",,
figure,Here's an example of a scatter plot.,NA,NA,NA,NA,mod1_scatter.R,new,NA,"continous, discrete, categorical",,
mult_question,"Of the three variables discussed previously: continuous, discrete, and categorical, which do you think would be most appropriate to use in a scatter plot?",Continuous; Discrete; Categorical,Continuous,word= Continuous,Think about which of the three variable types has an indefinite number of possible values.,NA,NA,NA,"continous, discrete, categorical",,
text,"To conclude this lesson, you are going to revisit all of the different types of plots I have discussed. After each plot appears, try your best to classify it. You will be amazed to see how much you have learned already!",NA,NA,NA,NA,NA,NA,NA,plot classification,,
figure,Here's your first plot.,NA,NA,NA,NA,mod1_bargraph.R,new,NA,plot classification,,
mult_question,Which type of plot is shown here?,Dot plot; Histogram; Stem-and-leaf plot; Bar graph; Box plot; Scatter plot,Bar graph,word= Bar graph,This type of graph is used to display a single categorical variable.,NA,NA,NA,plot classification,,
figure,Here's another.,NA,NA,NA,NA,mod1_scatter.R,new,NA,plot classification,,
mult_question,Which type of plot is shown here?,Dot plot; Histogram; Stem-and-leaf plot; Bar graph; Box plot; Scatter plot,Scatter plot,word= Scatter plot,This type of plot is used to show the relationship between two continuous variables.,NA,NA,NA,plot classification,,
figure,And another.,NA,NA,NA,NA,mod1_dotplot.R,new,NA,plot classification,,
mult_question,Which type of plot is shown here?,Dot plot; Histogram; Stem-and-leaf plot; Bar graph; Box plot; Scatter plot,Dot plot,word= Dot plot,This type of plot is used to visually convey the values of one variable using only one axis.,NA,NA,NA,plot classification,,
figure,Just a few more.,NA,NA,NA,NA,mod1_histogram.R,new,NA,plot classification,,
mult_question,Which type of plot is shown here?,Dot plot; Histogram; Stem-and-leaf plot; Bar graph; Box plot; Scatter plot,Histogram,word= Histogram,This type of plot partitions the values of your data into several bins.,NA,NA,NA,plot classification,,
figure,Keep going.,NA,NA,NA,NA,mod1_boxplot.R,new,NA,plot classification,,
mult_question,Which type of plot is shown here?,Dot plot; Histogram; Stem-and-leaf plot; Bar graph; Box plot; Scatter plot,Box plot,word= Box plot,This type of plot is used to summarize the main descriptive statistics of a particular data set.,NA,NA,NA,plot classification,,
figure,Last one!,NA,NA,NA,NA,mod1_stem.R,new,NA,plot classification,,
mult_question,Which type of plot is shown above?,Dot plot; Histogram; Stem-and-leaf plot; Bar graph; Box plot; Scatter plot,Stem-and-leaf plot,word= Stem-and-leaf plot,This type of plot organizes numerical data in order of decimal place value.,NA,NA,NA,plot classification,,
text,CONGRATULATIONS! You've completed your first lesson! I look forward to having you back for many more in the future.,NA,NA,NA,NA,NA,NA,NA,NA,,